{
  "$schema": "../schema/MemberTemplatePage.schema.json",

  "search": "검색",
  "searchResult": "'{{keyword}}' 검색 결과",
  "sorting": {
    "최근 생성 순": "최근 생성 순",
    "최근 수정 순": "최근 수정 순",
    "오래된 순": "오래된 순",
    "좋아요 순": "좋아요 순"
  },
  "topBanner": {
    "message": "님의 템플릿 입니다 :)"
  },
  "templateList": {
    "noResults": "검색 결과가 없습니다."
  }
}
